Title,Description,Location,Picture,Icon,Tags
Main exit,Main exit into Regent's Park.,"51.536235756815984,-0.15270888805389404",https://static.zsl.org/static/site/graphics/2011/london-zoo/logo.png,images/markers/exit.png,zoo exit
Tapir,Tapirs have changed little over 35 million years. They use their short flexible trunk as a snorkel when swimming. The dramatic colouring helps to break up the outline of the body to provide camouflage in the shady forests. The young are striped and look different from their mother.,"51.53468079405258,-0.15527307987213135",images/popups/tapiri.jpg,images/markers/tapir.png,tapir
Tiger Territory entrance,"Embark on a journey through an Indonesian habitat, coming face-to-face with stunning Sumatran tigers through the floor-to-ceiling glass windows.","51.534947744226685,-0.15490829944610596",images/popups/tigerterritoryi.jpg,images/markers/tiger.png,"sumatran tigers, jae jae, melati, endangered"
Toilets - Animal Adventure,"Male, female and disabled toilets plus baby-changing facilities.","51.533816532124966,-0.15331506729125974",https://static.zsl.org/static/site/graphics/2011/london-zoo/logo.png,images/markers/tiger-territory.png,facilities
Toilets - B.U.G.S.,"Male, female and disabled toilets plus baby-changing facilities.","51.53406012884638,-0.15157699584960938",https://static.zsl.org/static/site/graphics/2011/london-zoo/logo.png,images/markers/toilet-baby.png,facilities
Toilets - Into Africa,Male and female toilets.,"51.5359,-0.1578",https://static.zsl.org/static/site/graphics/2011/london-zoo/logo.png,images/markers/toilet-baby.png,facilities
Toilets - Terrace Restaurant,"Male, female and disabled toilets plus baby-changing facilities.","51.536075591431725,-0.15338480472564697",https://static.zsl.org/static/site/graphics/2011/london-zoo/logo.png,images/markers/toilet.png,facilities
Toilets - Vultures,"Male, female and disabled toilets plus baby-changing facilities.","51.5358,-0.1549",https://static.zsl.org/static/site/graphics/2011/london-zoo/logo.png,images/markers/toilet-baby.png,facilities
Warthogs,"Despite their reputation for gluttony, warthogs don't like overeating, and are very smart, adaptable animals. They live on the grasslands south of the Sahara and have very long legs to help them to run fast. Warthogs raise their young and take shelter in burrows dug by themselves or by aardvarks.","51.5358,-0.1588",images/popups/warthogi.jpg,images/markers/warthog.png,"into africa, african"
West bridge,Over the Regent's Canal.,"51.53640593191922,-0.15676438808441162",images/popups/westbridgei.jpg,images/markers/bridge.png,architecture
West tunnel,Take the west tunnel under the Outer Circle.,"51.53561177599392,-0.15650689601898193",https://static.zsl.org/static/site/graphics/2011/london-zoo/logo.png,images/markers/tunnel.png,architecture
Wildlife garden,Take a break in our wildlife garden and spot native species.,"51.53479257962853,-0.1518961787223816",https://static.zsl.org/static/site/graphics/2011/london-zoo/logo.png,images/markers/woodland.png,
Winnie the pooh statue,Winnie was a black bear who lived from 1915 until 1934 and was the inspiration for the famous children's story books written by A. A. Milne. ,"51.5339,-0.1535",https://static.zsl.org/static/site/graphics/2011/london-zoo/logo.png,images/markers/statue.png,"sculpture, history, famous animals"
Woodland Walk,Spot native species on the Wooldland Walk.,"51.5368,-0.1537",https://static.zsl.org/static/site/graphics/2011/london-zoo/logo.png,images/markers/woodland.png,british wildlife
Woodland walk - west entrance,Spot native species on the Woodland Walk.,"51.53636255401216,-0.15642642974853516",https://static.zsl.org/static/site/graphics/2011/london-zoo/logo.png,images/markers/woodland.png,british wildlife
Vultures,"Commonly misperceived throughout history as symbols of death, vultures actually plays a vital part of nature's clean-up crew helping prevent the spread of disease in many countries.","51.53588873110441,-0.1544871926307678",images/popups/vulturei.jpg,images/markers/vulture.png,"birds, bird route, ruppell's griffon, king vulture"
Yellow Mongooses,"In the wild, yellow mongooses are found in the scrubland and grasslands of southern Africa. They live in colonies of up to 20 individuals in underground burrow complexes. Their social structure is usually based around a central breeding pair and their offspring.","51.5335,-0.153",https://static.zsl.org/static/site/graphics/2011/london-zoo/logo.png,images/markers/mongoose.png,"animal adventure, children's zoo"
Zebras,"Chapman's zebra are social animals, living in large herds. They mix freely with groups of other grazing animals such as wildebeest. Together they form an effective early warning system against predators, such as lions and hyenas.  The stripes are thought to confuse predators; in a herd of zebra it is difficult for a hunting lion to see the outline of an individual zebra â€“ the stripes seem to merge across several animals, known as 'disruptive colouring'.","51.5355,-0.1579",images/popups/zebra.jpg,images/markers/zebra.png,"into africa, african"
ZSL offices and library,"Located on the Outer Circle, the Zoological Society of London's Library contains a unique collection of journals and books on zoology and animal conservation.","51.5367,-0.1528",images/popups/officei.jpg,images/markers/zsl.png,building
Zoo waterbus stop,The London Waterbus Company runs a scheduled service along the Regent's Canal between Camden Lock or Little Venice and ZSL London Zoo.,"51.5365,-0.156",https://static.zsl.org/static/site/graphics/2011/london-zoo/logo.png,images/markers/blue.png,"transport, boat"
Zoo World,"Temporary housing for some of the Zoo's small mammals including skunks, polecat ferrets and armadillos. The Casson Pavilion was designed by Sir Hugo Casson and built in 1952-5 as a home for the Zoo's elephant herd. The iconic concrete structure was inspired by elephants gathering around a watering hole.","51.53438381014425,-0.15439867973327637",images/popups/cassoni.jpg,images/markers/casson.png,"mammals, lemur, skunk, armadillo, kinkajou, ferrets, cassons, elephant house"
